{"action":{"kind":"schema-admission"},"assertions":{"instance_location":"strict-descendant-property","local_fragment":true,"productive":true,"work_unit_trace":[{"expected_units":17,"formula_inputs":{"cost":17},"iterations":1,"keyword":null,"machine_name":"json-value-cost","phase":"admission","source":"machine-formula","step_index":null},{"expected_units":2,"formula_inputs":{"resource_jcs_bytes":162},"iterations":1,"keyword":null,"machine_name":"resource_digest","phase":"admission","source":"machine-formula","step_index":null},{"expected_units":1,"formula_inputs":{},"iterations":1,"keyword":null,"machine_name":"graph_vertex","phase":"admission","source":"machine-action","step_index":null},{"expected_units":2,"formula_inputs":{},"iterations":2,"keyword":null,"machine_name":"graph_edge","phase":"admission","source":"machine-action","step_index":null},{"expected_units":3,"formula_inputs":{},"iterations":3,"keyword":null,"machine_name":"schema_location_entry","phase":"admission","source":"machine-action","step_index":null},{"expected_units":1,"formula_inputs":{},"iterations":1,"keyword":"$defs","machine_name":null,"phase":"admission","source":"keyword-step","step_index":0},{"expected_units":1,"formula_inputs":{},"iterations":1,"keyword":"$defs","machine_name":null,"phase":"admission","source":"keyword-step","step_index":1},{"expected_units":2,"formula_inputs":{},"iterations":2,"keyword":"$ref","machine_name":null,"phase":"admission","source":"keyword-step","step_index":0},{"expected_units":2,"formula_inputs":{},"iterations":2,"keyword":"$ref","machine_name":null,"phase":"admission","source":"keyword-step","step_index":1},{"expected_units":1,"formula_inputs":{},"iterations":1,"keyword":"$schema","machine_name":null,"phase":"admission","source":"keyword-step","step_index":0},{"expected_units":1,"formula_inputs":{"cost":1},"iterations":1,"keyword":"$schema","machine_name":null,"phase":"admission","source":"keyword-step","step_index":1},{"expected_units":1,"formula_inputs":{},"iterations":1,"keyword":"properties","machine_name":null,"phase":"admission","source":"keyword-step","step_index":0},{"expected_units":1,"formula_inputs":{},"iterations":1,"keyword":"properties","machine_name":null,"phase":"admission","source":"keyword-step","step_index":1},{"expected_units":1,"formula_inputs":{},"iterations":1,"keyword":"type","machine_name":null,"phase":"admission","source":"keyword-step","step_index":0},{"expected_units":1,"formula_inputs":{"cost":1},"iterations":1,"keyword":"type","machine_name":null,"phase":"admission","source":"keyword-step","step_index":1}]},"boundary":"local-object-structural-recursion","case_id":"local-object-recursion","category":"recursion","expected":{"contract_id":"org.intelliengine.conformance.profile","contract_version":"1.0.0","issues":[],"jcs_sha256":"98b776592caba761769d3b3089112c58740fc15327dba8c99f1a70246120458a","mode":"schema_admission","object_result":"valid","operation_outcome":"succeeded","profile_version":"1.0.0","raw_sha256":"a75232fbae887d568b25a00556ff97ac2d6e52ecd6341365026d0e025301901b","work_units_consumed":37},"input":{"bundle":[],"instance":null,"primary":"profile/1.0.0/fixtures/local-object-recursion/schema.json","schema":"profile/1.0.0/fixtures/local-object-recursion/schema.json"},"phase":"schema_admission","profile_version":"1.0.0","purpose":"Allows local recursion only when instance location descends through an object property.","resources":[]}
