{"action":{"kind":"semantic-validation"},"assertions":{"evaluated_items":[],"evaluated_properties":["kept"],"failed_branch_annotations":"discard","successful_anyOf_annotations":"merge","unevaluated_after_merge":true,"work_unit_trace":[{"expected_units":1,"formula_inputs":{},"iterations":1,"keyword":null,"machine_name":"schema_instance_pair","phase":"semantic","source":"machine-action","step_index":null},{"expected_units":1,"formula_inputs":{},"iterations":1,"keyword":"$schema","machine_name":null,"phase":"semantic","source":"keyword-step","step_index":0},{"expected_units":1,"formula_inputs":{},"iterations":1,"keyword":"anyOf","machine_name":null,"phase":"semantic","source":"keyword-step","step_index":0},{"expected_units":2,"formula_inputs":{},"iterations":2,"keyword":"anyOf","machine_name":null,"phase":"semantic","source":"keyword-step","step_index":1},{"expected_units":2,"formula_inputs":{},"iterations":2,"keyword":"anyOf","machine_name":null,"phase":"semantic","source":"keyword-step","step_index":2},{"expected_units":1,"formula_inputs":{},"iterations":1,"keyword":"title","machine_name":null,"phase":"semantic","source":"keyword-step","step_index":0},{"expected_units":1,"formula_inputs":{},"iterations":1,"keyword":"description","machine_name":null,"phase":"semantic","source":"keyword-step","step_index":0},{"expected_units":2,"formula_inputs":{},"iterations":2,"keyword":"type","machine_name":null,"phase":"semantic","source":"keyword-step","step_index":0},{"expected_units":1,"formula_inputs":{},"iterations":1,"keyword":"unevaluatedProperties","machine_name":null,"phase":"semantic","source":"keyword-step","step_index":0},{"expected_units":1,"formula_inputs":{},"iterations":1,"keyword":"unevaluatedProperties","machine_name":null,"phase":"semantic","source":"keyword-step","step_index":1},{"expected_units":1,"formula_inputs":{},"iterations":1,"keyword":"unevaluatedProperties","machine_name":null,"phase":"semantic","source":"keyword-step","step_index":2},{"expected_units":1,"formula_inputs":{},"iterations":1,"keyword":"unevaluatedProperties","machine_name":null,"phase":"semantic","source":"keyword-step","step_index":3},{"expected_units":1,"formula_inputs":{},"iterations":1,"keyword":"unevaluatedProperties","machine_name":null,"phase":"semantic","source":"keyword-step","step_index":4}]},"boundary":"successful-and-failed-annotation-branches","case_id":"annotation-propagation","category":"annotation","expected":{"contract_id":"org.intelliengine.conformance.profile","contract_version":"1.0.0","issues":[],"jcs_sha256":"10d8f2f9ddfaf4424215bf375dc6ebedd17edee086611307810e245faab4b27c","mode":"semantic_validation","object_result":"valid","operation_outcome":"succeeded","profile_version":"1.0.0","raw_sha256":"34d8105f275023e3ab91ff51d75d9c09f424b208232acfea8922175f1b9b7ca2","work_units_consumed":16},"input":{"bundle":[],"instance":"profile/1.0.0/fixtures/annotation-propagation/instance.json","primary":"profile/1.0.0/fixtures/annotation-propagation/schema.json","schema":"profile/1.0.0/fixtures/annotation-propagation/schema.json"},"phase":"semantic_validation","profile_version":"1.0.0","purpose":"Declares successful-only annotation propagation and late unevaluated processing.","resources":[]}
