{"action":{"kind":"parse-negative"},"assertions":{"parser_error":"unpaired-surrogate"},"boundary":"unpaired-surrogate","case_id":"parser-unpaired-surrogate","category":"parser","expected":{"contract_id":"org.intelliengine.conformance.profile","contract_version":"1.0.0","issues":[{"code":"conformance.fixture_invalid","path":"/a","severity":"error"}],"mode":"transport","object_result":"not_evaluated","operation_outcome":"indeterminate","profile_version":"1.0.0","raw_sha256":"89f8ca88ea20e6cd48ed0ab6b731b66377cab0c8fb9a7187ea96ac6813ed24e4","work_units_consumed":0},"input":{"bundle":[],"instance":null,"primary":"profile/1.0.0/fixtures/raw/unpaired-surrogate.raw","schema":null},"phase":"transport","profile_version":"1.0.0","purpose":"Rejects an escaped surrogate that is not paired into a Unicode scalar.","resources":[]}
