{"action":{"kind":"transport"},"assertions":{"jcs_key_order":["😀",""],"validator_key_order":["","😀"]},"boundary":"astral-vs-bmp-key-order","case_id":"sorting-utf16-vs-utf8","category":"sorting","expected":{"contract_id":"org.intelliengine.conformance.profile","contract_version":"1.0.0","issues":[],"jcs_sha256":"28c95d1bbb2209223307e62f489020e8f9e0cfa16adf2daf6d88127a1e8dd22a","mode":"transport","object_result":"valid","operation_outcome":"succeeded","profile_version":"1.0.0","raw_sha256":"90dd0cc8fe36f006faa643a1ccb2bc424434da7abd51bba32919d2c623ea8dad","work_units_consumed":0},"input":{"bundle":[],"instance":null,"primary":"profile/1.0.0/fixtures/sorting-utf16-vs-utf8/input.json","schema":null},"phase":"transport","profile_version":"1.0.0","purpose":"Keeps RFC 8785 UTF-16 key order distinct from validator UTF-8 traversal order.","resources":[]}
