{"action":{"kind":"parse-negative"},"assertions":{"parser_error":"bom-forbidden"},"boundary":"utf8-bom","case_id":"parser-bom","category":"parser","expected":{"contract_id":"org.intelliengine.conformance.profile","contract_version":"1.0.0","issues":[{"code":"conformance.fixture_invalid","path":"","severity":"error"}],"mode":"transport","object_result":"not_evaluated","operation_outcome":"indeterminate","profile_version":"1.0.0","raw_sha256":"aa25e978046d680ef8740d837e6de5bc1e2a2dc6089dbda1012544b538d53f65","work_units_consumed":0},"input":{"bundle":[],"instance":null,"primary":"profile/1.0.0/fixtures/raw/bom.raw","schema":null},"phase":"transport","profile_version":"1.0.0","purpose":"Rejects a UTF-8 BOM before JSON value construction.","resources":[]}
