{"action":{"kind":"verify-reference-graph"},"assertions":{"digest_verified_before_graph":true,"graph":"dag","topological_order":"uri-utf8"},"boundary":"two-resource-digest-dag","case_id":"cross-resource-dag","category":"reference-dag","expected":{"contract_id":"org.intelliengine.conformance.profile","contract_version":"1.0.0","issues":[],"jcs_sha256":"4c45acd692f793aeea096c198a819aae766c62b619b57c26dfdc2ab30e031429","mode":"schema_admission","object_result":"valid","operation_outcome":"succeeded","profile_version":"1.0.0","raw_sha256":"f8b1e54b502a78111e1a25f6326b0d451b308be0bd68f3d83a8cb18e3d10cbd4","work_units_consumed":0},"input":{"bundle":[],"instance":null,"primary":"profile/1.0.0/fixtures/cross-resource-dag/root.json","schema":null},"phase":"schema_admission","profile_version":"1.0.0","purpose":"Accepts an acyclic digest-addressed reference graph.","resources":[{"actual_sha256":"4c45acd692f793aeea096c198a819aae766c62b619b57c26dfdc2ab30e031429","claimed_sha256":"4c45acd692f793aeea096c198a819aae766c62b619b57c26dfdc2ab30e031429","path":"profile/1.0.0/fixtures/cross-resource-dag/root.json","refs":["urn:intelliengine:schema:sha256:612c3c87bf6797405b741d516ad1866d9395ec1d20276a5baf58fc676aabff2f"],"uri":"urn:intelliengine:schema:sha256:4c45acd692f793aeea096c198a819aae766c62b619b57c26dfdc2ab30e031429"},{"actual_sha256":"612c3c87bf6797405b741d516ad1866d9395ec1d20276a5baf58fc676aabff2f","claimed_sha256":"612c3c87bf6797405b741d516ad1866d9395ec1d20276a5baf58fc676aabff2f","path":"profile/1.0.0/fixtures/cross-resource-dag/leaf.json","refs":[],"uri":"urn:intelliengine:schema:sha256:612c3c87bf6797405b741d516ad1866d9395ec1d20276a5baf58fc676aabff2f"}]}
