{"action":{"kind":"replace","path":"profile/1.0.0/profile.json","pointer":"/schema_profile/keyword_ordinals/$ref","value":0},"assertions":{"ordinals":"unique-integers"},"boundary":"duplicate-keyword-ordinal","case_id":"keyword-ordinal-duplicate","category":"profile","expected":{"contract_id":"org.intelliengine.conformance.profile","contract_version":"1.0.0","issues":[{"code":"profile.duplicate_keyword_ordinal","path":"/schema_profile/keyword_ordinals","severity":"error"}],"jcs_sha256":"cbaad5c17a1e1315131b773c72be52834ed1f72a121323f68781970e8d6c413a","mode":"profile","object_result":"invalid","operation_outcome":"succeeded","profile_version":"1.0.0","raw_sha256":"3649f1e07a50086d5ad2b2ef475d494ad621e1c6ae5473cb568a22ca66b8ef88","work_units_consumed":0},"input":{"bundle":[],"instance":null,"primary":"profile/1.0.0/profile.json","schema":null},"phase":"profile","profile_version":"1.0.0","purpose":"Every allowed keyword has one unique deterministic ordinal.","resources":[]}
