{"action":{"kind":"parse-negative"},"assertions":{"parser_error":"duplicate-member"},"boundary":"duplicate-object-member","case_id":"parser-duplicate-key","category":"parser","expected":{"contract_id":"org.intelliengine.conformance.profile","contract_version":"1.0.0","issues":[{"code":"conformance.fixture_invalid","path":"/a","severity":"error"}],"mode":"transport","object_result":"not_evaluated","operation_outcome":"indeterminate","profile_version":"1.0.0","raw_sha256":"1c53ee0df7b12fd4d65b976120c7fa6b847dc41dffd7f0331c3237a1ceab1756","work_units_consumed":0},"input":{"bundle":[],"instance":null,"primary":"profile/1.0.0/fixtures/raw/duplicate-key.raw","schema":null},"phase":"transport","profile_version":"1.0.0","purpose":"Rejects duplicate members before object construction.","resources":[]}
