{"action":{"entry":{"digest_kind":"jcs_sha256","path":"profile/1.0.0/lock.json","sha256":"0000000000000000000000000000000000000000000000000000000000000000"},"kind":"append-lock-entry","path":"profile/1.0.0/lock.json"},"assertions":{"lock_path":"excluded"},"boundary":"lock-self-inclusion","case_id":"lock-self-inclusion","category":"lock","expected":{"contract_id":"org.intelliengine.conformance.profile","contract_version":"1.0.0","issues":[{"code":"lock.self_inclusion","path":"/entries","severity":"error"}],"mode":"profile","object_result":"invalid","operation_outcome":"succeeded","profile_version":"1.0.0","raw_sha256":"11bc454abefcf5d45c30ee5d780581027926d884f006a38d25126270c0c042c6","work_units_consumed":0},"input":{"bundle":[],"instance":null,"primary":"profile/1.0.0/lock.json","schema":null},"phase":"lock","profile_version":"1.0.0","purpose":"The lock excludes itself so its digest graph is finite.","resources":[]}
