{"action":{"kind":"verify-profile"},"assertions":{"machine_decisions":9,"schema_catalog":6},"boundary":"normal","case_id":"profile-baseline-valid","category":"profile","expected":{"contract_id":"org.intelliengine.conformance.profile","contract_version":"1.0.0","issues":[],"jcs_sha256":"cbaad5c17a1e1315131b773c72be52834ed1f72a121323f68781970e8d6c413a","mode":"profile","object_result":"valid","operation_outcome":"succeeded","profile_version":"1.0.0","raw_sha256":"3649f1e07a50086d5ad2b2ef475d494ad621e1c6ae5473cb568a22ca66b8ef88","work_units_consumed":0},"input":{"bundle":[],"instance":null,"primary":"profile/1.0.0/profile.json","schema":null},"phase":"profile","profile_version":"1.0.0","purpose":"A complete locked profile is structurally self-consistent.","resources":[]}
