{"action":{"kind":"remove","path":"profile/1.0.0/profile.json"},"assertions":{"required_path":"profile/1.0.0/profile.json"},"boundary":"missing-required-file","case_id":"profile-missing","category":"profile","expected":{"contract_id":"org.intelliengine.conformance.profile","contract_version":"1.0.0","issues":[{"code":"profile.missing_file","path":"/profile","severity":"error"}],"mode":"profile","object_result":"not_evaluated","operation_outcome":"indeterminate","profile_version":"1.0.0","raw_sha256":"3649f1e07a50086d5ad2b2ef475d494ad621e1c6ae5473cb568a22ca66b8ef88","work_units_consumed":0},"input":{"bundle":[],"instance":null,"primary":"profile/1.0.0/profile.json","schema":null},"phase":"profile","profile_version":"1.0.0","purpose":"A missing profile manifest cannot be verified.","resources":[]}
