{"action":{"kind":"schema-admission"},"assertions":{"ast":"compact-counter","linear":true,"maximum_repeat":10000,"parse_at":"admission","declaration_vectors":[{"pattern":"a{4}","result":"accept"},{"pattern":"a{1,4}","result":"accept"},{"pattern":"a{4,1}","result":"reject"},{"pattern":"\\.","result":"accept"},{"pattern":"\\q","result":"reject-private-escape"}],"work_unit_trace":[{"expected_units":7,"formula_inputs":{"cost":7},"iterations":1,"keyword":null,"machine_name":"json-value-cost","phase":"admission","source":"machine-formula","step_index":null},{"expected_units":2,"formula_inputs":{"resource_jcs_bytes":93},"iterations":1,"keyword":null,"machine_name":"resource_digest","phase":"admission","source":"machine-formula","step_index":null},{"expected_units":1,"formula_inputs":{},"iterations":1,"keyword":null,"machine_name":"graph_vertex","phase":"admission","source":"machine-action","step_index":null},{"expected_units":1,"formula_inputs":{},"iterations":1,"keyword":null,"machine_name":"schema_location_entry","phase":"admission","source":"machine-action","step_index":null},{"expected_units":1,"formula_inputs":{},"iterations":1,"keyword":"$schema","machine_name":null,"phase":"admission","source":"keyword-step","step_index":0},{"expected_units":1,"formula_inputs":{"cost":1},"iterations":1,"keyword":"$schema","machine_name":null,"phase":"admission","source":"keyword-step","step_index":1},{"expected_units":1,"formula_inputs":{},"iterations":1,"keyword":"pattern","machine_name":null,"phase":"admission","source":"keyword-step","step_index":0},{"expected_units":1,"formula_inputs":{"cost":1},"iterations":1,"keyword":"pattern","machine_name":null,"phase":"admission","source":"keyword-step","step_index":1},{"expected_units":7,"formula_inputs":{"pattern_scalars":6},"iterations":1,"keyword":"pattern","machine_name":null,"phase":"admission","source":"keyword-step","step_index":2},{"expected_units":4,"formula_inputs":{"ast_nodes":3},"iterations":1,"keyword":"pattern","machine_name":null,"phase":"admission","source":"keyword-step","step_index":3},{"expected_units":4,"formula_inputs":{"ast_nodes":3},"iterations":1,"keyword":"pattern","machine_name":null,"phase":"admission","source":"keyword-step","step_index":4},{"expected_units":1,"formula_inputs":{},"iterations":1,"keyword":"type","machine_name":null,"phase":"admission","source":"keyword-step","step_index":0},{"expected_units":1,"formula_inputs":{"cost":1},"iterations":1,"keyword":"type","machine_name":null,"phase":"admission","source":"keyword-step","step_index":1}]},"boundary":"allowed-alternation-and-bounded-greedy-repeat","case_id":"regex-grammar-boundary","category":"regex","expected":{"contract_id":"org.intelliengine.conformance.profile","contract_version":"1.0.0","issues":[],"jcs_sha256":"05b69553e46082886488f8fe52fe305ca96632973306c730927818eb5848aa99","mode":"schema_admission","object_result":"valid","operation_outcome":"succeeded","profile_version":"1.0.0","raw_sha256":"10011d7015136adebe7ff0e9b6693fc18663a7ee04a8f3a6555b726402b15e89","work_units_consumed":32},"input":{"bundle":[],"instance":null,"primary":"profile/1.0.0/fixtures/regex-grammar-boundary/schema.json","schema":"profile/1.0.0/fixtures/regex-grammar-boundary/schema.json"},"phase":"schema_admission","profile_version":"1.0.0","purpose":"Declares the accepted linear grammar and compact repeat representation.","resources":[]}
