{"action":{"kind":"work-unit-boundary","limit":1000000,"next_action_units":1,"phase":"semantic","preconsumed":999998},"assertions":{"no_partial_result":true,"resource_issue_count":0,"stopped_action":null},"boundary":"limit-minus-one","case_id":"work-unit-semantic-limit-minus-one","category":"work-unit","expected":{"contract_id":"org.intelliengine.conformance.profile","contract_version":"1.0.0","issues":[],"jcs_sha256":"011d667ce4dc9b128886f99763211270afab72df6d9c5f6004b4856c0c28494e","mode":"semantic_validation","object_result":"valid","operation_outcome":"succeeded","profile_version":"1.0.0","raw_sha256":"097cc1102de0f74d796ebb767eca9f8c608c326048b2439ba9d521b58b52be14","work_units_consumed":999999},"input":{"bundle":[],"instance":"profile/1.0.0/fixtures/work-unit-boundaries/instance.json","primary":"profile/1.0.0/fixtures/work-unit-boundaries/schema.json","schema":"profile/1.0.0/fixtures/work-unit-boundaries/schema.json"},"phase":"semantic_validation","profile_version":"1.0.0","purpose":"Executable semantic work-unit limit-minus-one boundary.","resources":[]}
