{"action":{"kind":"schema-admission"},"assertions":{"instance_location":"strict-descendant-array-item","local_fragment":true,"productive":true},"boundary":"local-array-structural-recursion","case_id":"local-array-recursion","category":"recursion","expected":{"contract_id":"org.intelliengine.conformance.profile","contract_version":"1.0.0","issues":[],"jcs_sha256":"adbbda43e596c8cec95c4a295ca688c76fa1944fc44e7cbd48480241aab04fad","mode":"schema_admission","object_result":"valid","operation_outcome":"succeeded","profile_version":"1.0.0","raw_sha256":"f8517af15f2d7e4cf4547b07254f336f9a84a81e60be1eb44a2efde062f9b773","work_units_consumed":0},"input":{"bundle":[],"instance":null,"primary":"profile/1.0.0/fixtures/local-array-recursion/schema.json","schema":"profile/1.0.0/fixtures/local-array-recursion/schema.json"},"phase":"schema_admission","profile_version":"1.0.0","purpose":"Allows local recursion only when instance location descends through an array item.","resources":[]}
