{"action":{"kind":"tamper","operation":"reverse-array","path":"profile/1.0.0/diagnostics/conformance.json","pointer":"/diagnostics"},"assertions":{"changed_bytes_with_unchanged_lock":"reject"},"boundary":"digest-tamper","case_id":"lock-digest-tamper","category":"lock","expected":{"contract_id":"org.intelliengine.conformance.profile","contract_version":"1.0.0","issues":[{"code":"conformance.digest_mismatch","path":"/entries","severity":"error"}],"mode":"profile","object_result":"not_evaluated","operation_outcome":"indeterminate","profile_version":"1.0.0","raw_sha256":"11bc454abefcf5d45c30ee5d780581027926d884f006a38d25126270c0c042c6","work_units_consumed":0},"input":{"bundle":[],"instance":null,"primary":"profile/1.0.0/lock.json","schema":null},"phase":"lock","profile_version":"1.0.0","purpose":"Changed normative bytes are rejected when the lock digest is unchanged.","resources":[]}
