{"action":{"kind":"verify-reference-graph"},"assertions":{"digest_verified_before_graph":true,"graph":"cycle-attempt","valid_cross_resource_cycle":false},"boundary":"cross-resource-cycle-attempt","case_id":"cross-resource-cycle-attempt","category":"reference-dag","expected":{"contract_id":"org.intelliengine.conformance.profile","contract_version":"1.0.0","issues":[{"code":"conformance.digest_mismatch","path":"/resources","severity":"error"}],"jcs_sha256":"b75a440a8dffb9fee5c6f171a373ef58e67b8cc6d2cbdd35155852b175618912","mode":"schema_admission","object_result":"not_evaluated","operation_outcome":"indeterminate","profile_version":"1.0.0","raw_sha256":"a34369cf35d4fb6fa0423211e116f0f0242daac681e6cd6d32db35411b0d54c1","work_units_consumed":0},"input":{"bundle":[],"instance":null,"primary":"profile/1.0.0/fixtures/cross-resource-cycle-attempt/resource-a.json","schema":null},"phase":"schema_admission","profile_version":"1.0.0","purpose":"Real resource bytes prove that a claimed mutual digest cycle mismatches before graph evaluation.","resources":[{"actual_sha256":"b75a440a8dffb9fee5c6f171a373ef58e67b8cc6d2cbdd35155852b175618912","claimed_sha256":"aaaaaaaaaaaaaaaaaaaaaaaaaaaaaaaaaaaaaaaaaaaaaaaaaaaaaaaaaaaaaaaa","path":"profile/1.0.0/fixtures/cross-resource-cycle-attempt/resource-a.json","refs":["urn:intelliengine:schema:sha256:bbbbbbbbbbbbbbbbbbbbbbbbbbbbbbbbbbbbbbbbbbbbbbbbbbbbbbbbbbbbbbbb"],"uri":"urn:intelliengine:schema:sha256:aaaaaaaaaaaaaaaaaaaaaaaaaaaaaaaaaaaaaaaaaaaaaaaaaaaaaaaaaaaaaaaa"},{"actual_sha256":"78030d0d35b89cbb7211d7d45831b8e542cdd34af7b8fdb3e2ef959e4ba2f08c","claimed_sha256":"bbbbbbbbbbbbbbbbbbbbbbbbbbbbbbbbbbbbbbbbbbbbbbbbbbbbbbbbbbbbbbbb","path":"profile/1.0.0/fixtures/cross-resource-cycle-attempt/resource-b.json","refs":["urn:intelliengine:schema:sha256:aaaaaaaaaaaaaaaaaaaaaaaaaaaaaaaaaaaaaaaaaaaaaaaaaaaaaaaaaaaaaaaa"],"uri":"urn:intelliengine:schema:sha256:bbbbbbbbbbbbbbbbbbbbbbbbbbbbbbbbbbbbbbbbbbbbbbbbbbbbbbbbbbbbbbbb"}]}
