{"action":{"kind":"schema-admission"},"assertions":{"instance_location":"unchanged","local_fragment":true,"productive":false},"boundary":"local-nonproductive-cycle","case_id":"local-nonproductive-cycle","category":"recursion","expected":{"contract_id":"org.intelliengine.conformance.profile","contract_version":"1.0.0","issues":[{"code":"conformance.fixture_invalid","path":"/resources","severity":"error"}],"jcs_sha256":"06e762fd02cc54adc95632ca702af6b607a9be02124eee5db08ed4361213bddb","mode":"schema_admission","object_result":"invalid","operation_outcome":"succeeded","profile_version":"1.0.0","raw_sha256":"82488b83da320bb976ae700e14e9df4d646a453503e7c0f4778efc5a470daa0f","work_units_consumed":0},"input":{"bundle":[],"instance":null,"primary":"profile/1.0.0/fixtures/local-nonproductive-cycle/schema.json","schema":"profile/1.0.0/fixtures/local-nonproductive-cycle/schema.json"},"phase":"schema_admission","profile_version":"1.0.0","purpose":"Rejects a local reference cycle that never advances the instance location.","resources":[]}
